[
  {
    "id": "acp",
    "group": null,
    "part_of": null,
    "name": "ACP (three protocols)",
    "aliases": [
      "Agent Client Protocol",
      "Agent Communication Protocol",
      "Agentic Commerce Protocol"
    ],
    "definition_md": "**ACP** refers to three unrelated protocols from three organisations at three different steps. Zed's *Agent Client Protocol* connects editors to coding agents (Act). IBM's *Agent Communication Protocol* was an agent-to-agent protocol, archived in August 2025 and merged into A2A (Coordinate, defunct). The OpenAI/Stripe *Agentic Commerce Protocol* lets an agent buy from a merchant (Pay). Published guides routinely state facts about one as though they applied to all; the widely repeated claim that \"ACP merged into A2A\" is true only of IBM's. A fourth, IBM's *Agent Commerce Protocol*, could not be verified as a distinct specification on 2026-09-05.",
    "step": null,
    "related_protocols": [
      "agent-client-protocol",
      "agent-communication-protocol",
      "agentic-commerce-protocol"
    ],
    "sources": [
      {
        "url": "https://agentclientprotocol.com",
        "date": "2026-09-05",
        "label": "VERIFIED"
      },
      {
        "url": "https://github.com/i-am-bee/acp",
        "date": "2025-08",
        "label": "VERIFIED"
      },
      {
        "url": "https://github.com/agentic-commerce-protocol/agentic-commerce-protocol",
        "date": "2026-04-17",
        "label": "VERIFIED"
      }
    ]
  },
  {
    "id": "agent-card",
    "group": null,
    "part_of": null,
    "name": "Agent Card",
    "aliases": [
      "A2A Agent Card",
      "agent-card.json"
    ],
    "definition_md": "An **Agent Card** is a JSON document that an A2A server publishes to describe itself to other agents: its identity (name, description, provider), its service endpoint URL, the A2A capabilities it supports (streaming, push notifications), its authentication schemes, and the skills it offers, each with an id, description, and input/output modes. A client agent fetches a card before talking to a server so it can decide whether to use it and how to structure requests. The recommended discovery mechanism is a well-known URI, `/.well-known/agent-card.json`, following RFC 8615, though curated registries and direct configuration are also defined discovery strategies. Cards can also be served behind authentication when they carry sensitive detail, using an \"authenticated extended\" variant. This is A2A's own discovery object; it is distinct from an MCP server card, which describes an MCP server rather than an A2A agent. Used by: a2a.",
    "step": "discover",
    "related_protocols": [
      "a2a"
    ],
    "sources": [
      {
        "url": "https://a2a-protocol.org/v1.0.0/topics/agent-discovery/",
        "date": "2026-09-05",
        "label": "VERIFIED"
      }
    ]
  },
  {
    "id": "server-card",
    "group": null,
    "part_of": null,
    "name": "MCP Server Card",
    "aliases": [
      "server-card",
      "mcp-server-card"
    ],
    "definition_md": "A **Server Card** is a proposed static, discoverable document that describes an MCP server: what it is, who publishes it, and how to reach it, without requiring a client to first open an MCP session. The mechanism is defined in SEP-2127, a Model Context Protocol enhancement proposal opened 21 January 2026 and still being updated as of 3 September 2026, which recommends serving the card at a `/server-card` path relative to the server's own endpoint rather than at a single global well-known location such as `/.well-known/mcp`; an earlier well-known-path proposal (SEP-1649) was superseded. Static cards intentionally omit the live list of tools, prompts and resources, which a client still has to fetch at runtime. Server cards can be advertised to an ARD registry with the media type `application/mcp-server-card+json`. As of the SEP's own text, implementation is limited to experimental SDK work and a demo; mainstream client auto-discovery of server cards is not established. Used by: mcp, ard.",
    "step": "discover",
    "related_protocols": [
      "mcp",
      "ard"
    ],
    "sources": [
      {
        "url": "https://github.com/modelcontextprotocol/modelcontextprotocol/pull/2127",
        "date": "2026-01-21",
        "label": "VERIFIED"
      },
      {
        "url": "https://agenticresourcediscovery.org/spec/",
        "date": "2026-08-26",
        "label": "VERIFIED"
      }
    ]
  },
  {
    "id": "well-known",
    "group": null,
    "part_of": null,
    "name": "Well-known URI",
    "aliases": [
      ".well-known",
      "/.well-known/"
    ],
    "definition_md": "A **well-known URI** is a path beginning `/.well-known/` at the root of an origin, reserved by RFC 8615 (May 2019, obsoleting RFC 5785) so that applications needing site-wide metadata do not have to negotiate arbitrary paths or risk colliding with a site's existing URL space. Anyone minting a new well-known name is expected to register it with IANA, referencing the specification that defines its format and media type; the mechanism itself defines no content at `/.well-known/` and clients should not assume anything exists there by default. The agentic web reuses this pattern heavily: `/.well-known/agent-card.json` (A2A), `/.well-known/ard.json` and its predecessor `/.well-known/ai-catalog.json` (ARD), and others each register or informally claim a name under this prefix rather than inventing a new discovery convention. Used by: a2a, ard, ai-catalog-well-known-file.",
    "step": "discover",
    "related_protocols": [
      "a2a",
      "ard",
      "ai-catalog-well-known-file"
    ],
    "sources": [
      {
        "url": "https://www.rfc-editor.org/rfc/rfc8615",
        "date": "2019-05",
        "label": "VERIFIED"
      }
    ]
  },
  {
    "id": "agentmap",
    "group": null,
    "part_of": null,
    "name": "Agentmap directive",
    "aliases": [
      "Agentmap:"
    ],
    "definition_md": "**Agentmap** is a line a publisher can add to `robots.txt`, of the form `Agentmap: https://example.com/entries.json`, that points a crawler at a source of Agentic Resource Discovery (ARD) entries as an alternative to relying solely on the well-known manifest path. It is defined in the ARD specification itself (v0.91, §5.1, 26 August 2026) as one of five discovery mechanisms alongside the well-known manifest, in-page JSON-LD markup, an HTML `<link rel=\"ard\">` tag, and DNS service-binding records; a conforming consumer is only required to fetch `/.well-known/ard.json` and honour `rel=\"ard\"`, so `Agentmap:` is a convenience a crawler may use, not something it must support. It is not part of RFC 9309 (the Robots Exclusion Protocol), so a robots.txt parser that does not know ARD is free to ignore the line, and no major AI crawler is documented as consuming it. Used by: ard.",
    "step": "discover",
    "related_protocols": [
      "ard"
    ],
    "sources": [
      {
        "url": "https://agenticresourcediscovery.org/spec/",
        "date": "2026-08-26",
        "label": "VERIFIED"
      }
    ]
  },
  {
    "id": "mandate",
    "group": null,
    "part_of": null,
    "name": "Mandate",
    "aliases": [
      "Payment Mandate",
      "Intent Mandate",
      "Checkout Mandate"
    ],
    "definition_md": "A **mandate** in Google's Agent Payments Protocol (AP2) is a cryptographically signed, verifiable credential that authorises an agent to act on a person's behalf for a specific purchase step. AP2 defines a chain of them: an intent mandate captures what the user asked for, a cart mandate binds the agent to specific items and a price, and a payment mandate authorises the actual charge; the Checkout Mandate is a related object, created by the shopping agent, rendered to the user, and countersigned by the merchant, that closes over an immutable, hashed checkout payload (`checkout_jwt`) so all three parties can verify what was actually agreed. Mandates use the SD-JWT verifiable-credential format, with a `vct` claim identifying the mandate type and version (for example `mandate.checkout.1`). The purpose is to let a human authorise an agent to transact without handing the agent standing account access: each mandate is scoped, signed and auditable after the fact. Used by: ap2, ap2-checkout-mandate.",
    "step": "pay",
    "related_protocols": [
      "ap2",
      "ap2-checkout-mandate"
    ],
    "sources": [
      {
        "url": "https://ap2-protocol.org/ap2/checkout_mandate/",
        "date": "2026-09-05",
        "label": "VERIFIED"
      },
      {
        "url": "https://github.com/google-agentic-commerce/AP2/blob/main/docs/ap2/specification.md",
        "date": "2026-04",
        "label": "VERIFIED"
      }
    ]
  },
  {
    "id": "facilitator",
    "group": null,
    "part_of": null,
    "name": "Facilitator",
    "aliases": [
      "x402 facilitator",
      "facilitator server"
    ],
    "definition_md": "A **facilitator** in the x402 protocol is an optional third-party service that verifies and settles blockchain payments on behalf of a resource server, so the server does not need its own blockchain connectivity or payment-verification logic. When a client retries a request with a signed payment payload, the server can either check and submit that payment itself or hand it to a facilitator's `/verify` and `/settle` endpoints, which check the payload against the server's declared requirements, broadcast the transaction, wait for confirmation, and return a result the server uses to decide whether to fulfil the request. A facilitator never holds client funds or acts as a custodian; it only executes and reports on signed, client-authorised transactions. x402.org runs a public facilitator intended for development and testnet use, and multiple independent facilitators run in production across several blockchain networks; a server may also \"self-facilitate\" by implementing the same logic in-process. Used by: x402.",
    "step": "pay",